{
  "baseline": {
    "identity": "agent-observability-eval-pipeline",
    "kind": "source-skill",
    "reason": "Closest immutable provenance root; Phase 9 compares the atomic candidate with this broader or provider-specific source behavior."
  },
  "candidate": {
    "contract_sha256": "6e2bf5a5edf000cffd32128d880e5cf366436eef86407ee7af6627d8567128a6",
    "identity": "production-llm-trace-root-cause-analysis@0.1.0-v2-candidate",
    "skill_sha256": "323ea9e773021f51c302f3d82abada483eb6635c0c4595364d5188f5672cfa68"
  },
  "execution_state": "not-run-phase-9",
  "holdout_case_ids": [
    "V2-P7-production-llm-trace-root-cause-analysis-holdout-trigger-01",
    "V2-P7-production-llm-trace-root-cause-analysis-holdout-anti-01"
  ],
  "mutations": [
    {
      "expected_gate": "required-semantic-marker",
      "id": "V2-P7-MUT-production-llm-trace-root-cause-analysis-01",
      "remove_exact_text": "Production LLM root cause requires governed trace provenance, versioned components, successful comparison cases, competing hypotheses, and a first divergent invariant; one bad output or model label is insufficient.",
      "target": "SKILL.md"
    }
  ],
  "rubric": [
    "exact target and immutable identity",
    "atomic permission and action scope",
    "current provider or production evidence integrity",
    "data credential and telemetry governance",
    "failure rollback revocation and cleanup",
    "readiness observation rollback and incident separation",
    "human authorization and durable receipt"
  ],
  "schema_version": "2.0",
  "skill_id": "production-llm-trace-root-cause-analysis",
  "status": "planned",
  "version": "0.1.0-v2-candidate"
}
