{
  "baseline": {
    "identity": "gstack",
    "kind": "source-skill",
    "reason": "Closest immutable source behavior; no released V1 Slot has this exact atomic responsibility."
  },
  "candidate": {
    "contract_sha256": "935f1e590aa14ffb80f2951bd10bb0d273b47b8ca8257c420cf49605cd4f6ede",
    "identity": "divergent-prototyping-and-variant-selection@0.1.0-v2-candidate",
    "skill_sha256": "386aa9db73a9f94ffc16dbd67123dbde804d1c0667c64241c256ef92c5f86788"
  },
  "execution_state": "not-run-phase-9",
  "holdout_case_ids": [
    "V2-P4-divergent-prototyping-and-variant-selection-holdout-trigger-01",
    "V2-P4-divergent-prototyping-and-variant-selection-holdout-anti-01"
  ],
  "mutations": [
    {
      "expected_gate": "required-semantic-marker",
      "id": "V2-P4-MUT-divergent-prototyping-and-variant-selection-01",
      "remove_exact_text": "At least two variants must differ structurally on declared axes; palette-only or typography-only alternatives do not count as divergence.",
      "target": "SKILL.md"
    }
  ],
  "rubric": [
    "product and design authority traceability",
    "user-flow and information-hierarchy preservation",
    "responsive state and accessibility completeness",
    "authentic content and asset provenance",
    "rendered-evidence integrity",
    "atomic boundary and human decision compliance"
  ],
  "schema_version": "2.0",
  "skill_id": "divergent-prototyping-and-variant-selection",
  "status": "planned",
  "version": "0.1.0-v2-candidate"
}
