{
  "baseline": {
    "identity": "competitive-strategy",
    "kind": "source-skill",
    "reason": "Closest source behavior; no released V1 Slot has this exact atomic responsibility."
  },
  "candidate": {
    "contract_sha256": "56455976391808ce38d619bd9c9ec6ceafe5dfaef4b88b48f1bd7ab3af4f2e72",
    "identity": "evidence-synthesis-and-opportunity-prioritization@0.1.0-v2-candidate",
    "skill_sha256": "110f500d2e28a88d165d8464db93aacaddbb3f73f3f94fc4ca6556695a586f61"
  },
  "execution_state": "not-run-phase-9",
  "holdout_case_ids": [
    "V2-P3-evidence-synthesis-and-opportunity-prioritization-holdout-trigger-01",
    "V2-P3-evidence-synthesis-and-opportunity-prioritization-holdout-anti-01"
  ],
  "mutations": [
    {
      "expected_gate": "required-semantic-marker",
      "id": "V2-P3-MUT-evidence-synthesis-and-opportunity-prioritization-01",
      "remove_exact_text": "No opportunity rank may be justified by source count alone or by silently converting assumptions into evidence.",
      "target": "SKILL.md"
    }
  ],
  "rubric": [
    "source and claim traceability",
    "unknown and conflict preservation",
    "atomic boundary adherence",
    "evidence-bounded actionable output",
    "human authority and data-governance compliance"
  ],
  "schema_version": "2.0",
  "skill_id": "evidence-synthesis-and-opportunity-prioritization",
  "status": "planned",
  "version": "0.1.0-v2-candidate"
}
