{
  "baseline": {
    "identity": "gstack",
    "kind": "source-skill",
    "reason": "Closest immutable provenance root; Phase 9 compares the atomic candidate with this broader or source-specific behavior."
  },
  "candidate": {
    "contract_sha256": "defbe3f940304cb77954d2f00afe2278e2d723b2728292daec092fb32f7e1c71",
    "identity": "workflow-skill-authoring@0.1.0-v2-candidate",
    "skill_sha256": "a3f7f3608f6d3a204606b881837f64e27db399eda6e192b922ec2a22e3845476"
  },
  "execution_state": "not-run-phase-9",
  "holdout_case_ids": [
    "V2-P6-workflow-skill-authoring-holdout-trigger-01",
    "V2-P6-workflow-skill-authoring-holdout-anti-01"
  ],
  "mutations": [
    {
      "expected_gate": "required-semantic-marker",
      "id": "V2-P6-MUT-workflow-skill-authoring-01",
      "remove_exact_text": "A candidate Skill must have one atomic responsibility, exact provenance, tested trigger boundaries, least authority, and no release claim; multi-stage orchestration belongs to a Recipe.",
      "target": "SKILL.md"
    }
  ],
  "rubric": [
    "target and authority traceability",
    "atomic mutation-scope adherence",
    "current executable or artifact evidence integrity",
    "failure and limitation preservation",
    "review-remediation and setup-action separation",
    "data credential local-system and remote governance",
    "determinism reproducibility and cleanup"
  ],
  "schema_version": "2.0",
  "skill_id": "workflow-skill-authoring",
  "status": "planned",
  "version": "0.1.0-v2-candidate"
}
