{
  "baseline": {
    "identity": "design-taste-frontend",
    "kind": "source-skill",
    "reason": "Closest immutable source behavior; no released V1 Slot has this exact atomic responsibility."
  },
  "candidate": {
    "contract_sha256": "42bbab304f6a827d76d39eb0fa06dbe06801e12a8cd71038da6bb831dcf9ab92",
    "identity": "visual-language-and-anti-template-controls@0.1.0-v2-candidate",
    "skill_sha256": "315fea51466edc5078216afef2f2dcf2ee5d189b720699aa14043447c5795d05"
  },
  "execution_state": "not-run-phase-9",
  "holdout_case_ids": [
    "V2-P4-visual-language-and-anti-template-controls-holdout-trigger-01",
    "V2-P4-visual-language-and-anti-template-controls-holdout-anti-01"
  ],
  "mutations": [
    {
      "expected_gate": "required-semantic-marker",
      "id": "V2-P4-MUT-visual-language-and-anti-template-controls-01",
      "remove_exact_text": "Every prominent visual device must serve hierarchy, task, content, state, or evidenced brand identity; unsupported decoration and generic template motifs must be removed.",
      "target": "SKILL.md"
    }
  ],
  "rubric": [
    "product and design authority traceability",
    "user-flow and information-hierarchy preservation",
    "responsive state and accessibility completeness",
    "authentic content and asset provenance",
    "rendered-evidence integrity",
    "atomic boundary and human decision compliance"
  ],
  "schema_version": "2.0",
  "skill_id": "visual-language-and-anti-template-controls",
  "status": "planned",
  "version": "0.1.0-v2-candidate"
}
