{
  "baseline": {
    "identity": "gstack",
    "kind": "source-skill",
    "reason": "Closest immutable provenance root; Phase 9 compares the atomic candidate with this broader or source-specific behavior."
  },
  "candidate": {
    "contract_sha256": "0ffbfdae776de2fb9e7e00fd5602b2911cccc718bfd0d12e50bc27ac852f16d6",
    "identity": "test-runtime-bootstrap@0.1.0-v2-candidate",
    "skill_sha256": "26650da416e6e606df352db93a34b8eeb8cebcc030b5b8396ced5c3b742f7143"
  },
  "execution_state": "not-run-phase-9",
  "holdout_case_ids": [
    "V2-P6-test-runtime-bootstrap-holdout-trigger-01",
    "V2-P6-test-runtime-bootstrap-holdout-anti-01"
  ],
  "mutations": [
    {
      "expected_gate": "required-semantic-marker",
      "id": "V2-P6-MUT-test-runtime-bootstrap-01",
      "remove_exact_text": "Bootstrap passes only when the project-local runtime and one real-behavior test run successfully; failed setup must restore dependency and configuration files exactly.",
      "target": "SKILL.md"
    }
  ],
  "rubric": [
    "target and authority traceability",
    "atomic mutation-scope adherence",
    "current executable or artifact evidence integrity",
    "failure and limitation preservation",
    "review-remediation and setup-action separation",
    "data credential local-system and remote governance",
    "determinism reproducibility and cleanup"
  ],
  "schema_version": "2.0",
  "skill_id": "test-runtime-bootstrap",
  "status": "planned",
  "version": "0.1.0-v2-candidate"
}
