{
  "baseline": {
    "identity": "gstack",
    "kind": "source-skill",
    "reason": "Closest immutable provenance root; Phase 9 compares the atomic candidate with this broader or source-specific behavior."
  },
  "candidate": {
    "contract_sha256": "a0d7615cdd5787d0a576c5598c24a1fd49bac9235df11810b1fc39719a66eaf3",
    "identity": "agent-workflow-runtime-support@0.1.0-v2-candidate",
    "skill_sha256": "decfb6ed40f6ce65c6b2a70bd3732bde3f8abb0796d48ed519e8c5e14a44d5c2"
  },
  "execution_state": "not-run-phase-9",
  "holdout_case_ids": [
    "V2-P6-agent-workflow-runtime-support-holdout-trigger-01",
    "V2-P6-agent-workflow-runtime-support-holdout-anti-01"
  ],
  "mutations": [
    {
      "expected_gate": "required-semantic-marker",
      "id": "V2-P6-MUT-agent-workflow-runtime-support-01",
      "remove_exact_text": "Runtime support may manage session mechanics only; it cannot execute, approve, or mark any domain capability complete from orchestration state.",
      "target": "SKILL.md"
    }
  ],
  "rubric": [
    "target and authority traceability",
    "atomic mutation-scope adherence",
    "current executable or artifact evidence integrity",
    "failure and limitation preservation",
    "review-remediation and setup-action separation",
    "data credential local-system and remote governance",
    "determinism reproducibility and cleanup"
  ],
  "schema_version": "2.0",
  "skill_id": "agent-workflow-runtime-support",
  "status": "planned",
  "version": "0.1.0-v2-candidate"
}
