{
  "baseline": {
    "identity": "gstack",
    "kind": "source-skill",
    "reason": "Closest source behavior; no released V1 Slot has this exact atomic responsibility."
  },
  "candidate": {
    "contract_sha256": "d63a4037e6047c1975a6cce812fbede7488cd739460ddad82f935e09abe126f6",
    "identity": "developer-experience-plan-review@0.1.0-v2-candidate",
    "skill_sha256": "3b2a6cd26f554e56326760d174bdd23048eefc4923269dbd56356e0e177c5d40"
  },
  "execution_state": "not-run-phase-9",
  "holdout_case_ids": [
    "V2-P3-developer-experience-plan-review-holdout-trigger-01",
    "V2-P3-developer-experience-plan-review-holdout-anti-01"
  ],
  "mutations": [
    {
      "expected_gate": "required-semantic-marker",
      "id": "V2-P3-MUT-developer-experience-plan-review-01",
      "remove_exact_text": "Do not substitute general code quality comments for evidence about a developer-facing journey.",
      "target": "SKILL.md"
    }
  ],
  "rubric": [
    "source and claim traceability",
    "unknown and conflict preservation",
    "atomic boundary adherence",
    "evidence-bounded actionable output",
    "human authority and data-governance compliance"
  ],
  "schema_version": "2.0",
  "skill_id": "developer-experience-plan-review",
  "status": "planned",
  "version": "0.1.0-v2-candidate"
}
