{
  "baseline": {
    "identity": "ai-product-strategy",
    "kind": "source-skill",
    "reason": "Closest immutable source behavior; no released V1 Slot has this exact atomic responsibility."
  },
  "candidate": {
    "contract_sha256": "6cbd4311675e6f2d22e071b336d94a874bb41547b62aee00ed8196c287c17831",
    "identity": "ai-agent-autonomy-and-human-control@0.1.0-v2-candidate",
    "skill_sha256": "d281c7f7f60ce43a2c9a562ae6c4ab1273740b2153b426af0e3559b7b6cc94e9"
  },
  "execution_state": "not-run-phase-9",
  "holdout_case_ids": [
    "V2-P5-ai-agent-autonomy-and-human-control-holdout-trigger-01",
    "V2-P5-ai-agent-autonomy-and-human-control-holdout-anti-01"
  ],
  "mutations": [
    {
      "expected_gate": "required-semantic-marker",
      "id": "V2-P5-MUT-ai-agent-autonomy-and-human-control-01",
      "remove_exact_text": "No action right expands without task-specific evidence, a named human owner, observable bounds, interruption, rollback or containment, and explicit approval.",
      "target": "SKILL.md"
    }
  ],
  "rubric": [
    "architecture and trust-boundary traceability",
    "authorization data and secret governance",
    "compatibility migration and rollback completeness",
    "failure abuse and residual-risk coverage",
    "atomic responsibility and mutation-scope adherence",
    "human approval and evidence integrity"
  ],
  "schema_version": "2.0",
  "skill_id": "ai-agent-autonomy-and-human-control",
  "status": "planned",
  "version": "0.1.0-v2-candidate"
}
